{
  "identity": "provider-neutral-runtime-remote-readonly-inspection-20261011-r1",
  "state": "CONSUMED_BEFORE_REMOTE",
  "prepared_commit_sha": "9b5da03e127599a1cd576b21acfe9b703a4b8b44",
  "plan_sha256": "ac172c1fbe586258aed378af9c53fa33d114e69b54a72b2471436c8d789de0ef",
  "target_manifest_sha256": "8315eac39526ed97126c3b5f85df9e150afc63186c224a3820fb03103bf11828",
  "workflow_sha256": "fa2299dfeb62f14534e75b2979b8e6fa186afa135bca578f5298496db2c7c1be",
  "helper_sha256": "4e5c746374757d77baf053c46c7516f65298f3cedbd8d37f6dea09242e619ee6",
  "offline_contract_sha256": "9edaabc4a00c563b6aaa6946405733014ac85144edae48db2ca1254aecd5a722",
  "candidate_bundle_sha256": "8a6615fd020ca6590ba8f5e2c73a3844473d9e6ecd3babb19ea836d604d4a8a9",
  "candidate_runtime_source_sha256": "134c97c36a0a20cc43b35e3dce1a1243a5d9008673ece5fb29f7cb8c3a52f3ea"
}
